
surpresa;;americano é notificado por andar de camelo e atrapalhar o trânsito. cena ocorreu em park city, no estado americano de utah. jason andreozzi estava distribuindo panfletos para promover filme.
medo;;anvisa vai fazer triagem em ônibus provenientes de países sul-americanos: até agora, controle era feito apenas em portos e aeroportos. governo decidiu controlar fronteira após caso confirmado na colômbia.
tristeza;;violentos combates e bombardeios continuam na síria. após uma noite de combates, qadam e tadamun, dois bairros pobres do sul de damasco onde os rebeldes tentam tomar a capital, continuavam sendo palco de enfrentamentos e disparos.
neutro;;fábio ferrario deixa o cargo de procurador-geral da ale de alagoas. advogado pediu exoneração do cargo para atuar na defesa de políticos. decisão deve sair no diário do oficial no início da próxima semana.
tristeza;;tornados na polônia deixam um morto e dez feridos. uma estranha onda de tornados de verão devastou as regiões norte e oeste da polônia, causando a morte de pelo menos uma pessoa e ferindo outras dez.
tristeza;;motociclista foge após causar acidente em boa vista, diz polícia. duas pessoas ficaram feridas no acidente de trânsito neste domingo 
tristeza;;acidente de helicóptero deixa 4 mortos na inglaterra. um acidente de helicóptero causou a morte de quatro pessoas ontem à noite no condado de norfolk, no leste da inglaterra, informou nesta sexta-feira a polícia.
neutro;;tesouro nacional capta mais us$ 25 milhões no mercado asiático: na quarta, foi anunciada emissão de us$ 500 mi nos eua e europa. oferta foi estendida ao mercado asiático na madrugada desta quinta.
tristeza;;teto de igreja cai e mata uma pessoa em carmo do cajuru, mg. estrutura metálica atingiu duas pessoas; ferido foi evado para clínica. existe a possibilidade de vítimas serem trabalhadores da obra.
neutro;;definição sobre candidatura de ciro ao governo de sp pode sair até mês que vem: psb quer definir situação eleitoral nos estados até o final de agosto. segundo cúpula do partido, pesquisas animam ciro gomes e o psb.
desgosto;;indústria empurra novas drogas, sem garantir que são melhores que antigas: interesses comerciais acabam muitas vezes atrapalhando tratamentos. opinião é de psquiatra americano, em artigo no jornal "new york times".
alegria;;primeiro centro de pesquisa brasileiro da boeing é inaugurado em são josé. objetivo é desenvolver projetos em parceria com setor aeroespacial. empresa é a maior do mundo no setor; brasil é o 6º país a receber centro.
alegria;;arqueólogos encontram vestígios com mais de 1.200 anos em mg: pesquisadores localizaram amostras de vegetais em montes claros. com projeto, cientistas querem aproximar comunidade das descobertas.
tristeza;;corpo de coreano morto em obra do metrô deixa a capital baiana. segundo consulado, corpo de kim jong pyo segue para a coreia na sexta. vítima morreu após choque próximo à estação acesso norte.
tristeza;;estresse no trânsito vira rotina para milhares de brasileiros. nos últimos 20 anos, o tempo de deslocamento subiu três vezes. problema afeta saúde dos brasileiros.
tristeza;;pm prende suspeito de atropelar e arrastar adolescente em juiz de fora. jovem de 21 anos foi localizado na manhã desta sexta-feira (14). na casa dele, no santa efigênia, pm encontrou droga e bombas caseiras.
tristeza;;novos ataques do boko haram deixam dezenas de mortos na nigéria. homens atacaram vilarejos no estado de borno. muitos habitantes fugiram para o camarões, diz deputado.
neutro;;senador do piauí sofre cirurgia de redução de estômago em sp: heráclito fortes (dem) passa bem e ainda está na uti. assessoria diz que senador deve ficar de licença por uma semana.
tristeza;;stf nega pedido para que sean seja ouvido por juiz antes de voltar aos eua: avó do menino tenta impedir que ele volte para guarda de david goldman. pai biológico disputa guarda de sean com família brasileira.
tristeza;;última etapa de projeto aponta seis locais impróprios para banho no rs. fepam analisa locais no litoral, balneários e barras do estado. na última semana, nove pontos não eram aconselhados para banho.
tristeza;;ex-campeão mundial de boxe é baleado em porto rico. o ex-pugilista porto-riquenho hector "macho" camacho, campeão mundial em três categorias diferentes do boxe nas décadas de 80 e 90, foi baleado quando estava dentro de um carro nos arredores de san juan, capital de porto rico.
tristeza;;menina de 15 anos é acorrentada pela avó em ms: segundo a polícia, avó se cansou da desobediência da neta em amambaí. ela vai responder em liberdade por cárcere privado.
neutro;;psdb é mais próximo do pmdb nos estados que o pt, diz aécio: governador diz acreditar em mais alianças psdb-pmdb nos estados. mineiro acredita que interesses regionais vão prevalecer em 2010.
desgosto;;setor de telefonia lidera reclamações de call centers, diz ministério da justiça: 57% das demandas vêm de pessoas insatisfeitas com essas empresas. governo pede condenação de r$ 300 milhões para duas telefônicas.
tristeza;;incêndio destrói vegetação em goiânia: fumaça escura assustou motoristas, que tiveram de acender os faróis. bombeiros demoraram cerca de sete horas para controlar o fogo.
desgosto;;israel limita acesso de palestinos a áreas de jerusalém. as autoridades de israel limitaram, a partir de hoje (23), o acesso de palestinos a várias áreas de jerusalém, cidade considerada sagrada para os judeus, cristãos e muçulmanos.
neutro;;pib medido pelo itaú unibanco sobe 1,2% em fevereiro. o pib mensal itaú unibanco (pibiu) subiu 1,2% em janeiro deste ano ante dezembro de 2013 e exibiu uma alta também de 1,2% em relação a janeiro de 2013.
tristeza;;explosão mata dois na espanha: ataque destruiu carro em quartel da guarda civil na ilha de mallorca. na quarta, carro-bomba feriu 60 no norte do país.
tristeza;;general dissidente sai ileso de atentado suicida na líbia. khalifa haftar foi alvo de ataque; três soldados morreram. benghazi é considerado um reduto de muitas milícias islamitas armadas.
neutro;;lula se reúne com líderes do g5: ele se encontrou com líderes da índia, méxico, áfrica do sul e china. reunião é realizada em laquila, na itália, onde também ocorre o g8.
tristeza;;avalanche nos alpes austríacos mata seis pessoas: tragédia envolveu cinco excursionistas tchecos e um eslovaco. com a ajuda de helicópteros, polícia conseguiu recuperar corpos.
neutro;;no maranhão, lula pede que divergências políticas sejam deixadas de lado: presidente visitou áreas afetadas pelas enchentes no estado e no piauí. ele pediu que prefeitos apresentem projetos de recuperação ao governo.
raiva;;filhos são suspeitos de abandonar pai idoso para se apropriar dos bens. polícia encontrou homem de 71 anos após denúncia, em anápolis, go.
alegria;;laboratórios apresentam bons resultados em drogas para o câncer: testes clínicos mostraram potencial contra tumor de intestino, pele e mama. dados ainda são preliminares; estudos com pacientes humanos continuam.
neutro;;brics não vão discutir reservas em novas moedas, afirma rússia: líderes da rússia, china, índia e brasil se reunirão na segunda-feira (15). segundo assessor, reforma de instituições financeiras será tema.
neutro;;renato faz mistério no flu, mas confirma carlinhos fora. o técnico renato gaúcho resolveu fazer mistério nesta sexta-feira após comandar o penúltimo treino do fluminense para o clássico deste domingo, contra o vasco, às 18h30, no maracanã, pela 14ª rodada do campeonato carioca.
neutro;;psirico faz show em comemoração a emancipação de cachoeira, na bahia. cidade histórica completou 177 anos de emancipação na quinta-feira (13). programação festiva segue até domingo (16), no recôncavo baiano.
neutro;;lula suspende agenda da manhã para receber líderes do governo: presidente cancelou ida a evento da marinha e adiou encontro com serra. ele se reuniu com líderes da câmara e senado, além de temer e múcio.
tristeza;;ônibus incendiado na colômbia circulava ilegalmente, diz ministra. ônibus não tinha registro desde 2012 nem seguro, segundo ministra. 32 crianças e um adulto morreram no incidente, em fundación.
neutro;;cientistas observam e filmam sexo violento de aranhas: cópula violenta, mas eficiente, ocorre entre aranhas de uma espécie proveniente de israel.
neutro;;entrega do primeiro monotrilho é adiada em sp. o governo geraldo alckmin (psdb) anunciou nesta sexta-feira, 14, que a entrega do primeiro sistema de monotrilho da capital paulista não ocorrerá em março, conforme anunciado no início do ano.
neutro;;líder do governo no congresso diz que oposição tem ‘atitude autoritária’: ideli salvatti (pt-sc) criticou impasse sobre relatoria da cpi das ongs. lula alterou agenda para receber múcio, temer e líderes do governo.
medo;;mais uma noite violenta em sp, com oito mortos. ao menos oito pessoas foram mortas e cinco feridas a tiros em mais uma noite de violência na região metropolitana de são paulo.
raiva;;elefante tem presas e cauda cortadas por caçadores e morre na índia. ataque ocorreu nesta quinta (6) em goalpura, no nordeste do país. em foto, animal aparece deitado em poça de lama após lutar pela vida.
medo;;terceiro dia seguido de ataques criminosos e ônibus incendiados em florianópolis.pelo terceiro dia seguido, a grande florianópolis viveu uma noite de verdadeiro terror. além de quatro ônibus incendiados, uma creche desativada foi também incendiada.
surpresa;;menino de 8 anos se casa com mulher de 61 a mando de fantasma do avô. cerimônia foi organizada pela família, que ficou com medo de ser punida pelo espírito
tristeza;;morre mais uma gestante vítima de nova gripe no rio, diz médica: grávida de 6 meses morreu nesta quinta (30), no hospital rocha faria. segundo secretaria de saúde, óbito ainda não consta no sinan.
neutro;;história de amor e crônica pós-katrina ganham prêmio literário nos eua. o prêmio, entregue na quinta-feira em nova york, abrange obras publicadas no último ano nos eua
neutro;;índice europeu de ações fecha em baixa, pressionado por bancos: referência para o continente, o ftseurofirst 300 caiu 0,99%. deutsche bank aumentou reservas contra calotes; ação caiu 11%.
tristeza;;caminhão fica destruído após colisão com carreta na br-116, na bahia. acidente ocorreu na noite de quinta-feira (13), a 320 km de salvador. prf informou que o trânsito ficou congestionado durante 50 minutos.
neutro;;japão volta a ter deflação e vê salto do desemprego: índice de preços ao consumidor recuou 0,1% em março sobre 2008. taxa de desemprego saltou para 4,8%, maior nível em quatro anos.
neutro;;veja lista com frases e gestos de francisco que marcam seu estilo. papa criticou a mundanidade e mostrou proximidade com o homem comum. argentino completa um ano à frente da igreja católica nesta quinta (13).
tristeza;;morador flagra cachorro dentro de pronto socorro em guarujá, sp. ele ficou indignado com a situação e com a demora no atendimento.
neutro;;mulher de berlusconi diz que vai entrar com pedido de divórcio: veronica lario acusou marido de se relacionar com menores. primeiro-ministro italiano se recusou a comentar o caso.
tristeza;;trem bate em ônibus escolar e mata 51 no egito. segundo autoridades, ao menos 51 pessoas morreram, a maioria delas crianças.
tristeza;;sete suspeitos de envolvimento com garimpos clandestinos são presos em mt: cinco maquinários usados na extração de ouro foram apreendidos. ação da polícia federal e ibama ocorreu na região de peixoto de azevedo.
tristeza;;polícia iraniana detém 2 jornalistas belgas durante protestos em teerã: jornalistas ficaram cerca de uma hora detidos e foram liberados. além deles, mais de cem manifestantes e opositores também foram detidos.
tristeza;;aviação de israel ataca damasco e síria ameaça retaliar. israel lançou dois ataques contra o território sírio em menos de três dias.
neutro;;tse manda tirar propaganda de aécio no facebook. segundo a decisão de humberto martins, o perfil promove propaganda antecipada do mineiro
tristeza;;menino fica entalado em janela ao invadir casa em porto velho. polícia usou sabão para tentar remover a estrutura, que teve de ser cortada. pais do adolescente foram chamados à delegacia para liberá-lo.
tristeza;;rompimento de barragem deixa pelo menos 500 famílias fora de casa: defesa civil diz que está procurando por dois adolescentes, que sumiram. na quarta-feira, nível da água chegou a 20 metros.
medo;;nova gripe faz universidade federal do paraná suspender aulas até o dia 10: suspensão abrange todos os campi da instituição. motivo é reduzir a possibilidade de transmissão da nova gripe.
alegria;;ursa polar é fotografada brincando com bola em zoo alemão. cena foi registrada no zoológico de bremerhaven. imagem foi feita pela fotógrafa carmen jaspersen.
tristeza;;sobe para 54 o número de mortes no haiti pelo furacão sandy. também foram registrados 21 desaparecimentos 20 pessoas feridas.
medo;;tensão em boston: polícia cerca quarteirões em busca de terrorista. nas outras regiões da cidade, ruas vazias: pessoas ficam em casa para evitar correr risco
neutro;;‘brasil poderá ter uma presidente mulher’, diz dilma: declaração foi dada após encontro com michelle bachelet em sp. ‘a sociedade está madura para isso’, disse a ministra.
tristeza;;50 soldados sírios morrem em explosão de carro-bomba, diz grupo ativista. pelo menos 50 pessoas ligadas ao governo do presidente da síria, bashar al assad, morreram nesta semana.
tristeza;;chuvas já atingiram cerca de 80 mil pessoas no ceará: do total, 11.383 estão desalojadas e 5.498 estão desabrigadas. chuva danificou 1.543 casas e destruiu 461 em todo o estado.
tristeza;;trabalhadores do transporte intermunicipal continuam em greve. ônibus estão parados na br-135 e exigem melhorias salariais. greve acontece desde a noite de domingo (18).
neutro;;presidente mexicano assina decreto para mudar nome do país. a uma semana de deixar o poder, o presidente mexicano, felipe calderón, assinou decreto para alterar a constituição, substituindo o nome do país de estados unidos mexicanos para, simplesmente, méxico.
neutro;;juiz de fora recebe encontros empresariais em maio e junho. ação orienta sobre formalização e administração de empresas. estão programadas orientações em diversos bairros da cidade.
surpresa;;pato de borracha gigante aparece no rio tâmisa, em londres. figura de 15 m foi usada para promover empresa de jogos online. tower bridge foi erguida para que pato atravessasse.
neutro;;senado autoriza governo a pedir garantia de empregos para empréstimos: proposta foi incluída na mp que capitaliza o bndes em r$ 100 bilhões. texto segue para a sanção do presidente luiz inácio lula da silva.
neutro;;empresários esperam investir mais em 2014, mostra pesquisa. otimismo está acompanhado, porém, de uma preocupação relacionada às condições climáticas e aos efeitos que possíveis desabastecimentos de água e luz podem causar à economia
tristeza;;homem confessa que matou a própria família em penha. luiz carlos flores, 38 anos estava sob efeito da droga quando matou o pai, a mãe, a irmã e o sobrinho de 10 anos a marteladas. a chacina ocorreu na noite de sexta, no bairro armação.
surpresa;;estudante queimada em sessão de bronzeamento recebe alta, em goiás. mãe comemora recuperação: ela está bem emocionalmente, animada. treze mulheres se queimaram ao passar óleo de coco com canela, em jataí.
neutro;;distribuição gratuita de camisinhas bate recorde no brasil: governo diz que 406 milhões de unidades foram distribuídas em um ano. ministério da saúde anuncia que pode entregar número ainda maior.
tristeza;;dois bombardeios matam 17 pessoas no paquistão. dois bombardeios em duas áreas diferentes do paquistão mataram 17 pessoas e feriram dezenas nesta sexta-feira.
neutro;;vídeo flagra momento em que paciente para de respirar durante sono. homem internado em clínica britânica sofre de apneia obstrutiva do sono.
medo;;violência torna lomba grande um bairro com medo. comunidade na área rural de novo hamburgo está apreensiva com o aumento de roubos à mão armada. criminalidade já mudou rotina da região.
desgosto;;drogas e celulares são apreendidos em unidade socioeducativa de cuiabá. revista na unidade de internação foi feita após indícios de irregularidades. também foram encontrados chips e carregadores de celular, segundo sejudh.
surpresa;;canadense é condenado por morder cadela de estimação. ronald samuel pegou 40 horas de serviço comunitário. ele foi flagrado em setembro mordendo sua cadela jazzy.
medo;;camundongos atacam idosos em asilo na austrália: veterano de guerra teve ferimentos no rosto, no pescoço e nas orelhas.
alegria;;candidatos aprovados em concurso do huufma são convocados. ao todo, foram convocados 280 profissionais. candidatos deverão se apresentar no período de 21 a 23 de maio.
neutro;;miss tocantins pesca, caça e participa de clube de tiro: natália araújo bichuete, 18 anos, pretende estudar arquitetura. candidatas disputam final de concurso de beleza no próximo sábado (9).
neutro;;kraft foods registra lucro 10% maior no trimestre: ganho líquido foi de us$ 660 milhões. receitas líquidas caíram 6,5% entre janeiro e março.
medo;;nova gripe já contaminou 7.520 pessoas em 34 países, segundo a oms: estados unidos são o país com maior número de casos: 4.298. agência da onu diz que o pior pode ainda não ter passado.
desgosto;;lavrov: não há visão comum sobre crimeia. o ministro das relações exteriores da rússia, sergey lavrov, disse que as diferenças entre moscou e os estados unidos sobre a crise na ucrânia persistem, mesmo após as negociações em londres.
alegria;;grêmio empata sem gols com newell´s e segue na ponta. partida realizada em porto alegre fez com que time gaúcho alcançasse os sete pontos contra quatro do adversário
tristeza;;trf suspende retirada de índios kaiowá de terras em ms: desembargadora concedeu prazo de 90 dias para funai e funasa. instituições devem realizar estudos para retirar das famílias.
desgosto;;pf e força nacional começam operação de retirada de não índios da raposa: prazo para saída de produtores de arroz da área acabou na quinta. desembargador disse que força só será usada caso haja resistência.
desgosto;;pre apreende maconha, armas e dinheiro na pa-150. dois quilos de maconha foram encontrados com suspeito. homem foi preso e encaminhado para a delegacia para prestar depoimento.
desgosto;;em 4 dias, base de fiscalização apreende 45 caminhões de madeira ilegal em ro: ibama, pf e prf reforçaram vigilância em posto em rodovia. estrada liga rondônia ao centro-sul do país.
tristeza;;francês sequestrado desde 2011 aparece em vídeo em canal árabe. serge lazarevic foi sequestrado em novembro de 2011 no mali. ele pede a hollande para que faça algo para a sua libertação.
neutro;;cão que passa roupa é destaque em show de talentos: concurso britânico reúne animais de estimação que jogam hockey e dançam.
surpresa;;menina britânica que ganhou direito de morrer é operada: jovem mudou de ideia e foi submetida a transplante de coração em londres.
tristeza;;laboratório confirma que botulismo matou menina de 6 anos em al: lacen divulgou resultado positivo de testes na manhã desta terça-feira. uma criança e dois adolescentes continuam internados na uti.
desgosto;;supermercados dizem que deixarão de comprar carne de desmatadores: empresas atendem a pedido do ministério público federal. pelo menos 21 fazendas embargadas pelo ibama vendem carne no pará.
neutro;;barack obama e mitt romney: a incógnita das eleições americanas. pelo equilíbrio entre os dois candidatos e pelas diferentes propostas em meio à crise, os americanos dizem amanhã se querem mais obama ou se rejeitam o seu governo.
surpresa;;competição de salto em distância para sapos reúne dezenas na croácia. evento é realizado desde 1975 na cidade de lokve. frognight reuniu 37 participantes este ano.
desgosto;;presidente do senado reconhece recebimento irregular de auxílio-moradia: josé sarney recebe desde o ano passado mesmo tendo imóvel no df. ele mandou cancelar seu benefício e prometeu novas regras.
medo;;vazamento de gás mata uma pessoa em são paulo. a construção onde os produtos químicos estavam não desmoronou, mas uma equipe da defesa civil avalia se a estrutura do prédio ficou danificada
surpresa;;posto de combustíveis sem bombas pega motoristas de surpresa em sp. local teve atividade revogada por vender combustível fora dos padrões. no entanto, estabelecimento segue funcionando com loja de conveniência.
tristeza;;igreja católica atua por reserva indígena em roraima: bispo da diocese de roraima incentivou briga pela demarcação. produtores rurais dizem que ele foi responsável pela quebra da harmonia.
desgosto;;substituto de fausto de sanctis libera venda de gado do opportunity: antes de sair de férias, juiz do caso determinou sequestro de gado. pf aponta lavagem de dinheiro do grupo de daniel dantas em fazendas.
tristeza;;trabalhadores madrugam em fila para seguro desemprego em porto velho. posto do ministério do trabalho distribui apenas 30 senhas por dia. trabalhadores chegam de madrugada para tentar atendimento que inicia às 8.
neutro;;pmdb e pt indicam líderes do governo para cpi da petrobras: romero jucá (pmdb-rr) e ideli salvatti (pt-sc) foram indicados. aloízio mercadante (sp), líder do pt, ficou de fora.
tristeza;;premiê turco condena manifestações após funeral de adolescente. policial e manifestante morreram em protestos durante funeral. erdogan acusou autores de protestos de instaurarem o caos no país.
tristeza;;navio francês retoma as buscas das caixas-pretas do voo 447: pourquoi pas está na área do desastre e vasculha fundo do mar. sonar e submarinos ajudam na procura.
neutro;;onu nomeia outro brasileiro para comandar força de paz no haiti. general josé luiz jaborandy júnior substituirá edson leal pujol. oficial atuou na amazônia e até então estava no comando de área no pa.
medo;;chuva causa estragos em pernambuco e em mato grosso do sul: em caruaru, lojas fecharam e parte da vegetação foi arrastada. em campo grande, ventos chegaram a 86 km/h.
neutro;;porto velho assina acordo com consórcio de jirau: empresa fará investimentos compensatórios no município. pendência impedia liberação de licença do ibama.
neutro;;ônibus espacial endeavour inicia volta para a terra: nave desacoplou às 14h26 da estação espacial internacional (iss). tripulação instalou equipamentos de pesquisa no complexo orbital.
tristeza;;malásia diz que imagens de satélite chinês não mostravam destroços. imagens provocaram esperanças na localização de avião desaparecido. buscas por aeronave com 239 pessoas entraram no sexto dia.
alegria;;carneiros sobrevivem após 23 dias presos na neve. animais perdidos em região montanhosa na irlanda do norte foram encontrados por homem que passeava com cachorro.
desgosto;;carne bovina apresenta alta de 13% no último ano na rmb, diz dieese. segundo o órgão, em abril o aumento foi de 3% em relação a março. aumento deve continuar no mês de maio de acordo com dieese.
neutro;;sindicato cubano celebra 50 anos da revolução no dia do trabalho: foi comemorado o compromisso com o socialismo. o presidente raúl castro comandou o ato principal.
neutro;;inflação na zona do euro bate recorde de baixa em abril: taxa foi de 0,6% em abril deste ano frente ao mesmo mês do ano passado. na comparação com março, alta foi de 0,4%.
tristeza;;parentes e amigos participam de missa para vítimas do voo 447 na alemanha: homenagem aconteceu na igreja johannes, em duesseldorf. 26 alemães estavam a bordo do avião, que desapareceu no dia 31/5.
neutro;;ladrão de banco é detido nos eua com camiseta que previa sua prisão. rocky fisher foi preso após roubar banco e usar dinheiro em cassino. americano usava roupa com frase que prevendo que diversão iria acabar.
surpresa;;aos 115 anos, japonês se torna homem que mais viveu, diz guiness.jiroemon kimura completou 115 anos e 253 dias nesta sexta. ele é a pessoa viva mais velha; recorde de idade atingida é de mulher.
alegria;;ney latorraca melhora e pode deixar cti na semana que vem. ator está acordado, sem febre e terá aparelho de respiração artificial removido
neutro;;confiança do consumidor nos eua cai a 46,6 em julho: em junho, índice medido pelo conference board chegou a 49,3. taxa de expectativa sobre atividade econômica em 6 meses também caiu.
surpresa;;raro peixe-cavalo é flagrado nos eua. ele foi encontrado em nags head, no estado da carolina do norte. com dentes afiados, peixe-cavalo tem hábito de comer a própria espécie.
tristeza;;hospital da indonésia atende alunos com nova gripe em ala improvisada: oms alertou 6ª-feira que crianças em idade escolar são as mais afetadas. agência da onu não contabiliza mais notificações ao redor do mundo.
tristeza;;fãs se despedem de paulo goulart no municipal de sp. uma fila de dobrar o quarteirão estava armada na manhã desta sexta-feira, 14, na calçada do teatro municipal de são paulo, onde é velado o corpo do ator paulo goulart, morto na quinta-feira, 13.
tristeza;;menino de 10 anos morre em desabamento em salvador: segundo a defesa civil da capital baiana, outras 8 pessoas ficaram feridas. engenheiro do órgão está no local para checar as causas do acidente.
