
tristeza;;brasileiros que estão em gaza pedem ajuda para deixar a região. um grupo de 20 brasileiros, que têm também nacionalidade palestina, pediu ajuda ao escritório do brasil em ramallah, na cisjordânia, para deixar momentaneamente a faixa de gaza por temer o agravamento dos conflitos.
neutro;;estudo revela morada de inverno dos tubarões-elefante: criaturas migram para as regiões tropicais, fugindo do frio. achado surpreendente foi obtido com ajuda de satélites.
tristeza;;batida entre três caminhões na br-277 bloqueia estrada por 1h30. acidente ocorreu no quilômetro 4, ainda dentro da cidade de paranaguá, e causou interdição de 1h30 na estrada. não houve feridos na ocorrência, segundo a prf
neutro;;conheça as diferenças entre os principais índices de inflação: indicadores mostram variações de preços com abrangências diferentes. inflação oficial é medida pelo ipca.
raiva;;britânico se passava na internet por "chantelle", 14 anos, para atacar meninas. um britânico foi condenado a 14 anos e quatro meses de prisão por estuprar uma menina de 12 anos do condado de hampshire depois de aliciá-la pela internet fingindo ser uma adolescente.
neutro;;berzoini chama empresários que demitem sem precisar de ladrões: presidente do pt participou de festa do dia do trabalho da cut. josé genoíno também participou do evento da central.
tristeza;;manhã tem dois acidentes no mesmo trecho de rua de joão pessoa. segundo a pm, condutor do veículo perdeu o controle da direção. em seguida, no mesmo local, um ônibus coletivo atropelou um ciclista.
tristeza;;gari morre ao ser prensado em caminhão de coleta de lixo em ro. funcionário da coleta urbana tinha 27 anos e morreu no local do acidente. caminhão baú invadiu a preferencial, segundo testemunhas.
alegria;;foguete decola com satélites europeus de observação: planck e herschel vão estudar origens do universo. sondas alcançarão sua órbita dentro de 60 dias.
medo;;dois casos de bactéria multirresistente são registrados em hospital da capital. uma bactéria com forte resistência a antibióticos foi detectada em dois pacientes em porto alegre.
raiva;;exame de dna aponta que argentino teve 7 filhos com a própria filha: outra filha também diz que foi molestada pelo pai. homem está em prisão de segurança máxima.
tristeza;;bebê morre após ser atropelado por avô na garagem de casa, em trindade. menina de 1 ano e 4 meses chegou a ser socorrida, mas não resistiu. homem não viu neta ao retirar a caminhonete da garagem, segundo polícia.
surpresa;;homem que acordou em funerária morre de verdade nos eua. acho que desta vez ele se foi, disse sobrinha. homem havia chocado cidade ao acordar em funerária.
surpresa;;empresário acusado de estupro e roubo de cargas é solto em são josé. cícero estava preso desde o último dia 4 de abril, pelos crimes de porte ilegal de armas e estupro contra uma menina de 12 anos.
surpresa;;monges sequestram chineses em mina de cobre em mianmar. dois chineses foram feitos reféns, segundo dona de mina. sequestradores exigem a paralisação total do projeto.
alegria;;porco-espinho ronca ao ser filmado durante soneca generosa. dono filmou animal de estimação ao ouvir barulho curioso. albertino ki escreveu que comportamento é frequente.
neutro;;mercado de celulares deve apresentar recuo de 13,6% no 2º trimestre: números ainda são melhores frente ao colapso do início de 2009. principais fabricantes apresentarão seus balanços ainda neste mês.
tristeza;;investigadores do caso pistorius contaminaram arma do crime. policial confessou ato em declaração durante julgamento. atleta sul-africano responde pela morte da namorada, reeva steenkamp.
tristeza;;eua confirmam possível nova área de busca de avião no oceano índico. segundo a casa branca, novas informações levam a abrir rota. boeing 777 da malaysia airlines com 239 a bordo está sumido desde dia 7.
alegria;;risco de câncer cai à metade com 30 minutos de exercícios ao dia, diz estudo: universidades finlandesas avaliaram homens de 42 a 61 anos de idade. trabalho foi publicado no british journal of sports medicine.
tristeza;;familiares se despedem de gina franco durante velório. corpo de gina franco é velado no instituto augusto franco sepultamento será realizado às 17h no cemitério santa izabel.
tristeza;;suspensão de toque de recolher causa fuga em massa no paquistão: carros e ônibus lotados deixam o vale do swat, onde exército enfrenta militantes do talibã.
surpresa;;zoológico de moscou exibe rara cobra de duas cabeças. réptil em exibição na capital russa é da espécie cobra real californiana. segundo zoo, ocorrência de cobras de 2 cabeças é de uma em 1 milhão.
tristeza;;explosão em ônibus deixa pelo menos 10 feridos em tel aviv. circunstâncias do incidente ainda não estão esclarecidas, mas governo israelense trata como atentado.
medo;;frança tem primeiros casos de gripe suína; vírus chega também a hong kong: grã-bretanha tem primeiro paciente que não foi ao méxico. estados unidos veem casos aumentarem de 109 para 141.
neutro;;vettel admite alívio após bom desempenho em treino. sebastian vettel não escondeu o alívio após se destacar nos treinos livres do gp da austrália, nesta sexta-feira, em melbourne.
alegria;;michelle obama inova com jeito franco na casa branca: primeira-dama dos eua é conhecida por ser honesta e pé no chão. mães se identificam com seus comentários sobre família e trabalho.
tristeza;;cerca de 120 pessoas morrem no incêndio em fábrica têxtil em bangladesh.além das mortes, cerca de 100 trabalhadores ficaram feridos.
tristeza;;italiano da seleção é internado com lesão no tórax. o lateral-direito do napoli e da seleção italiana, christian maggio, foi internado em um hospital de nápoles, na noite de quinta-feira, por conta de uma trauma pneumo-torácico.
tristeza;;tempestade sandy deixa rastro de 71 mortes no caribe, a maioria no haiti. a passagem do furacão sandy, rebaixado à categoria de tempestade, pelo caribe deixou para trás um rastro de 71 mortes.
desgosto;;empresária suspeita de matar família no rs vai para penitenciária: ela foi levada para a penitenciária madre pelletier, em porto alegre. empresária do setor calçadista estava presa em hospital desde 15 de abril.
medo;;clientes de shopping se assustam com suposta bomba deixada por trio durante assalto. os bandidos deixaram a suposta bomba em cima do balcão da loja, deixando os funcionários e clientes assustados.
desgosto;;senadores com imóvel em brasília continuarão recebendo auxílio-moradia: mão santa (pmdb-pi) afirma que benefício é para todos. josé sarney (pmdb-ap), não precisaria, mas vai devolver.
surpresa;;perito particular questiona imagens de acidente com ex-deputado no pr: família de vítima contratou profissional para fazer simulação da colisão. segundo ele, alguns segundos do filme do acidente foram removidos.
neutro;;líderes da câmara fecham acordo para votar projetos ignorando mps: casa irá convocar sessões para votar matérias mesmo com mps na fila. posição é respaldada em liminar do supremo tribunal federal.
neutro;;eua e china se comprometem a estender diálogo econômico: países tiveram encontro sobre economia, em washington. americanos pediram liberalização do setor financeiro aos chineses.
medo;;quadrilha faz arrastão em prédio de bairro nobre de caxias do sul (rs): ladrões amarraram reféns na garagem e entraram em cinco apartamentos. o bando ficou cerca de três horas no prédio.
surpresa;;entre amazônia e andes, ruínas revelam civilização anterior aos incas: chachapoyas construíam casas redondas no alto das montanhas. estudiosos tentam descobrir como cidades desapareceram.
alegria;;ceará libera mais r$ 1,1 milhão a cidades atingidas pela chuva: dinheiro beneficiará acaraú, itarema, marco, pacujá e quixeramobim. devem ser comprados cobertores, cestas básicas e outros produtos.
surpresa;;mulher cai em cima de crocodilo e animal é hospitalizado na rússia. incidente ocorreu em van de circo a caminho da cidade de murmansk. russa de 120 kg caiu em cima do réptil após manobra brusca do veículo.
neutro;;crimeia aumenta medidas de segurança às vésperas de referendo. população local vai escolher se quer ou não aderir à rússia no domingo. cerca de 1,5 milhão de pessoas devem votar no referendo.
tristeza;;chuvas condenam 150 casas em duque de caxias. pelo menos 40 casas estão condenadas em duque de caxias, na baixada fluminense, por causa da enxurrada de quinta-feira (3), que matou duas pessoas na cidade.
tristeza;;não quero morrer, gritavam crianças em escola onde aconteceu massacre nos eua. 20 crianças e sete adultos foram mortos por atirador, que depois se matou.
tristeza;;servidores aposentados são vítimas de quadrilha de estelionatários no rj. criminosos prometem ajuda para que vítimas recebam benefícios. um aposentado depositou r$ 7 mil numa conta da quadrilha.
neutro;;candidato à presidência do irã diz que falará com eua de posição "superior": mohsen rezaei é definido como candidato "conservador moderado". ele é ex-comandante do corpo dos guardiães da revolução islâmica.
alegria;;táxis de maceió ganham biblioteca móvel em parceria com editora. projeto bibliotáxi permite que o passageiro leve um livro para casa. passageiros encontram dois exemplares dentro dos táxis.
surpresa;;indianos engolem peixe vivo contra asma: receita teria sido passada por guru a família no século 19. animal é ingerido junto com ervas medicinais.
tristeza;;chega a 7 o número de mortos em desabamento de prédios em ny. nove pessoas ainda são procuradas nos escombros. acidente deixou pelo menos 70 feridos em manhattan.
alegria;;cnj proíbe magistrados de usar carros oficiais nos fins de semana e feriados: resolução também veta o uso dos veículos por familiares de juízes. regra é válida para todo o judiciário, menos ministros do stf.
surpresa;;presidente do egito amplia o próprio poder por decreto. as emendas blindam qualquer tentativa do judiciário de dissolver o painel constituinte e além disso reabrem os julgamentos dos ex-funcionários públicos do regime de hosni mubara
tristeza;;explosão em tel-aviv deixa dez pessoas feridas. a explosão de um ônibus em tel-aviv, em israel, deixou dez pessoas feridas nesta quarta-feira, de acordo com informações do serviço de emergências israelenses.
tristeza;;presa, mãe confessa ter espancado criança de 3 anos em go, diz polícia. agressão teria ocorrido porque filha vomitou e limpou o chão com a roupa. menina teve perfuração no intestino e está internada em estado grave.
tristeza;;corpo de dentista de caiabu chega ao brasil; enterro será nesta quinta. luana pinheiro golim camargo foi morta em lisboa; marido é suspeito. velório será às 8h, na igreja matriz de santo antônio.
neutro;;lula se diz favorável a corte permanente do ipi para carros: ele disse que dilma, se eleita, não abandonará pilares do governo atual. presidente concedeu entrevista exclusiva à agência de notícias reuters.
neutro;;lucros da viacom caem 32% no segundo trimestre: queda dos rendimentos afetou resultado do grupo de comunicação. empresa norte-americana lucrou us$ 277 milhões no período.
tristeza;;inundações na sérvia e na bósnia matam mais de 40 pessoas. cerca de 50 mil estão desabrigados nos dois países, nos bálcãs. diques protegem central de energia na sérvia.
alegria;;leão resgatado de circo em ms ganha nova casa: ele será levado para santuário ecológico em cotia (sp). segundo promotor de justiça, animal mostra boa recuperação.
tristeza;;explosão destrói ônibus e mata sete passageiros no quênia. episódio ocorreu em um bairro de nairóbi onde vive grande número de somalis ou quenianos de origem somali, deixando pelo menos sete mortos.
tristeza;;motorista de ônibus incendiado que matou crianças na colômbia é detido. veículo pegou fogo na noite deste domingo (18). motorista se entregou e prestará depoimento.
neutro;;confiança do consumidor nos eua tem forte alta em abril: o índice avançou para 65,1 em abril, ante 57,3 em março. esta foi a 1ª alta na comparação ano a ano desde julho de 2007.
neutro;;centrais fazem 1º de maio com shows, prêmios e protesto por juro menor: força sindical pretende reunir 10 milhões em festas pelo país. cut mudou estratégia neste ano e promoverá atos menores e serviço.
tristeza;;acidente em mina deixa 22 mortos na china. acidente ocorreu em uma mina de carvão no sudoeste do país. causa foi um escapamento de gás.
desgosto;;vítimas de caçadores, 13 tartarugas-da-amazônia são apreendidas no pa: animais foram capturados com anzóis e iscas. espécie tem caça proibida, informa o ibama.
alegria;;jornalista merval pereira ganha prêmio da universidade de columbia: faculdade de jornalismo é uma das mais respeitadas do mundo. além do brasileiro, blogueira cubana recebeu menção especial.
surpresa;;médicos tentam explicar origens das cãibras noturnas: episódios são comuns, sobretudo em pessoas mais velhas. múltiplas causas podem estar ligadas ao fenômeno.
desgosto;;homem mantém a ex-mulher refém por 13 horas e põe fogo na casa nos eua: caso ocorreu em south windsor, connecticut. ele acabou se rendendo logo após o início do incêndio.
desgosto;;jovem foge de cativeiro após ser torturado durante nove dias em sp. rapaz de 21 anos foi sequestrado quando ia ao trabalho em cubatão. família chegou a pagar o resgate duas vezes para os criminosos.
desgosto;;jovem rouba cartão de crédito da mãe e faz gracinha em foto da polícia. caso ocorreu em alliance, no estado de ohio. john funk tentou usar o cartão na frente da polícia.
surpresa;;vinho tinto aumenta libido feminina, diz estudo: pesquisadores avaliaram questionários de quase 800 mulheres.
surpresa;;casal leva susto ao flagrar jacaré de 2,4 m em piscina de casa nos eua. sharon bente pensou que barulho no quintal era causado por tempestade. animal ficou nadando em círculos em piscina até ser capturado.
alegria;;feira do procon oferece serviços gratuitos e orientações em curitiba. evento faz parte da celebração do dia internacional do consumidor. atendimentos são feitos até as 17h desta sexta-feira (14), no centro.
desgosto;;professores são acusados de fazer sexo com alunas na áfrica do sul: em troca, elas recebiam dinheiro e bebidas. caso é investigado, mas acusados ainda têm empregos garantidos.
neutro;;funcionários dos correios voltam a trabalhar após greve em mato grosso. paralisação de atividades começou no dia 30 de janeiro em 15 estados. categoria cobrava melhorias no trabalho, saúde e plano de carreira.
surpresa;;russa de 61 anos revive após passar 3 dias em necrotério. lyudmila steblitskaya acordou pouco antes da realização da autópsia. cozinheira aposentada já voltou à vida em outro episódio.
surpresa;;cinco imóveis são demolidos no recife: estabelecimentos estavam em área pública e não tinham alvará . proprietários disseram que aguardavam decisão da justiça.
tristeza;;vídeo mostra abordagem policial em que rapaz morre em beberibe, no ce. caída no chão, vítima é chutada. segundo testemunhas, a vítima estava sobre efeito de drogas.
neutro;;força sindical faz festa do dia do trabalho na zona norte de são paulo: evento conta com programação política e de shows. custo foi de r$ 2,3 milhões.
neutro;;embate histórico sobre impostos em salvador - ii. no artigo anterior comentei conflitos sobre tributos municipais, antes de 1964, em que dois prefeitos de salvador foram vencidos pela influência política de interesses empresariais, respaldados pelo estado.
neutro;;pé de tomate com frutos amarelos atrai curiosos em mg: rachadura em piso de quintal permitiu crescimento de planta. tomates amarelos chamaram a atenção de técnicos da emater.
alegria;;organização mundial da saúde vai enviar remédio contra a nova gripe a 72 países: antiviral tamiflu havia sido doado pela roche à agência da onu. estoque é suficiente para tratar 2,4 milhões de pacientes.
raiva;;vinte pássaros silvestres são apreendidos em casa no pará: animais eram criados sem autorização do ibama. rouxinol, japiim, curió e tem-tem estão entre espécies encontradas.
tristeza;;criança de 2 anos morre após comer pimenta como castigo nos eua. mulher que seria namorada do pai da menina foi presa. autópsia será realizada para determinar a exata causa da morte.
neutro;;ministro brasileiro visita cuba para aumentar comércio e investimento: miguel jorge, da indústria e comércio, fica até quinta-feira (9) na ilha. brasil é o segundo parceiro comercial da ilha na região após a venezuela.
tristeza;;manifestantes queimam carro em honduras: grupo pede o retorno de zelaya à presidência do país. encontro na costa rica nessa quinta pode ser início do fim da crise.
neutro;;fundo de pensão cobra r$ 3,6 bilhões do bndes. eventual reconhecimento da dívida aumentaria pouco o passivo do bndes, pois o valor representa apenas 0,46% do passivo total, de r$ 782,043 bilhões
alegria;;filhote de peixe-boi é resgatado em santarém (pa): animal de cerca de cinco meses ficou preso em rede de pesca. após receber tratamento, ele deve voltar à natureza.
neutro;;vale encerra programa de recompra de ações: previsão inicial era de que término fosse em outubro. no período, a vale adquiriu 47.284.800 ações preferenciais.
surpresa;;conheça o avião que ficou desaparecido por meio século. entre as causas cogitadas para a queda do stardust, estavam um atentado e extraterrestres; ao final, o motivo era bem mais simples
medo;;fiorella mattheis foge de arrastão no rio: "eu vivi momentos de pânico". "arrastão e tiroteio na linha vermelha perto da baixada sentido rj. pânico total, voltei na contramão...vivi há poucos minutos um momento de pânico e medo total.
tristeza;;acidente deixa três mortos e dois feridos na br-101. uma colisão envolvendo uma carreta, uma caçamba e um carro-forte deixou três mortos e dois feridos na manhã desta sexta-feira, no km 207, da br-101, trecho de governador mangabeira (a 119 quilômetros de salvador).
medo;;eua admitem que lançamento de míssil norte-coreano não seria surpresa. o pentágono disse que irá instalar interceptores de mísseis nas bases dos estados unidos em guam
alegria;;sete municípios do amapá vão ter internet banda larga por fibra óptica. expectativa é comercializar pacote com 1 mega ao valor de r$ 69. lançamento da tecnologia acontecerá na segunda-feira (17) em macapá.
tristeza;;americana mata filhos, ex-marido e madrasta para receber r$ 1,4 milhão. mulher cometeu os crimes e tentou incriminar um dos filhos.
tristeza;;nigéria teme centenas de mortes em suposto ataque do boko haram. ataque aconteceu na terça contra quatro cidades do estado de borno. muitos habitantes fugiram para o camarões, diz deputado.
neutro;;lula descarta reduzir ritmo de obras no são francisco devido à crise: presidente disse que foi criado turno adicional para gerar empregos. ele também edisse que governo está aumentando investimento no pac.
tristeza;;idosa de 83 anos morre após acidente entre carro e caminhão em viradouro. carro colidiu na traseira de veículo que transportava cana na madrugada. motorista passou por exames em uma unidade básica de saúde.
surpresa;;pescadores levam susto após tubarão saltar dentro do barco. o norte-americano jason kresse disse que um tubarão de 2,4 metros e 170 quilos saltou dentro de seu barco enquanto ele e dois colegas estavam pescando na segunda-feira no golfo do méxico.
surpresa;;cnbb: padres devem respeitar lei disciplinar do celibato: conduta deve ser seguida por heterossexuais e homossexuais, diz cnbb. conferência, que acaba hoje, reuniu nos últimos dez dias 330 bispos.
tristeza;;caxias do sul confirma duas mortes pela nova gripe: vítimas são dois homens, segundo a secretaria municipal de saúde. ao todo, cidade soma três casos de óbito pelo vírus influenza a.
surpresa;;terra pode vir a colidir com outro planeta no futuro, alerta simulação: dupla usou supercomputador para simular futuro do sistema solar. chance de bagunça é de 1% nos próximos 5 bilhões de anos.
neutro;;campeãs do mundo do handebol apenas empatam com argentina. apesar do tropeço, time do técnico morten soubak tem melhor saldo de gols e deve garantir medalha de ouro no sábado, contra o uruguai
neutro;;codau retoma obras de nova adutora de abastecimento de água. construção agora passa pela avenida antônio rios. tubulações interligam eta ao centro de reservação do bairro olinda.
neutro;;merkel adverte rússia sobre consequências de ação na ucrânia. chanceler alemã defendeu solução com os príncipios do século xxi. ela é considerada a figura mais influente da ue na crise da crimeia.
neutro;;loteria italiana acumula prêmio recorde de 110 milhões de euros: prêmio equivale a r$ 291 milhões. sorteio está há várias semanas sem ganhador.
surpresa;;pessoas produzem anticorpos naturais contra mal de alzheimer, diz estudo: pesquisa identificou prevenção do próprio organismo contra doença. se for possível estimular mecanismo, casos de demência podem diminuir.
tristeza;;china condena nove pessoas à morte por terrorismo na região de xinjiang. repressão ocorre após violentos ataques no país. governo também anunciou detenção de 29 suspeitos de terrorismo.
surpresa;;gata sobrevive a ciclo completo na máquina de lavar roupa nos eua . caso ocorreu em oakland, no estado da califórnia. mulher não percebeu que felino entrou no equipamento.
tristeza;;chuva provoca prejuízos em quatro estados: três morreram na bahia; escolas viraram abrigo no piauí e no ceará. estradas interditadas no maranhão provocam desabastecimento.
neutro;;9 cidades do am terão recursos para combater dsts e hepatites virais. portaria que autoriza o repasse foi publicada no diário oficial da união. valor anual chega a r$ 2.876.461,0, diz ministério da saúde.
surpresa;;paraense teve que engordar 7 kg para participar do miss brasil: rayana breda, de 19 anos, é modelo internacional desde os 15. final do miss brasil 2009 acontece em são paulo, em 9 de maio.
neutro;;neblina fecha aeroporto afonso pena por sete horas: pousos foram proibidos das 3h às 10h deste domingo. apenas decolagens foram autorizadas no mesmo período.
tristeza;;ao menos 14 morrem pisoteados em festival na índia. ao menos 14 pessoas morreram pisoteadas, incluindo seis crianças, no fim da tarde desta segunda (19), em um festival religioso no estado de bihar, no nordeste da índia.
surpresa;;estudo nos eua liga vírus comum a pressão alta: pesquisadores preveem criação de vacina contra o vírus cmv, que causaria endurecimento das artérias.
tristeza;;enterro de paulo goulart será no início da tarde. velório reuniu celebridades. o ator morreu nesta quinta (13) depois de complicações causadas por um câncer de pulmão
tristeza;;cinco bebês mortos são achados em porão na finlândia. polícia prendeu suposta mãe dos bebês em oulu. mulher de 35 anos disse que bebês eram seus filhos que nasceram mortos.
tristeza;;bebê nasce infectado com nova gripe na tailândia: o bebê nasceu prematuro no sábado (25). a mãe ainda continua muito doente no hospital.
tristeza;;instituto diz que 119 jornalistas foram mortos em 2012 no mundo. o ipi divulgou os dados durante reunião, em viena, na áustria, promovida pela associação de editores de imprensa e pelo serviço de informações das nações unidas.
neutro;;brasileiros estão entre bancos com maior rentabilidade das américas, diz pesquisa: ações de bancos brasileiros tiveram alta em 2009. instituições financeiras menores tiveram melhor rentabilidade.
neutro;;vice josé alencar antecipa viagem para são paulo: vice-presidente vem semanalmente, às quintas, para realizar exames. ele passa por tratamento contra câncer.
neutro;;polícia federal faz buscas na casa do ex-presidente da assembleia de mt. pf também esteve no apartamento do governador silval barbosa. eder moraes foi preso na manhã desta terça-feira durante operação.
tristeza;;pistorius: "meu bebê, eu matei meu bebê. deus, me leva". atleta ligou para o amigo após o crime e teria confessado que matou a namorada. ele pode pegar prisão perpétua.
surpresa;;ave usa 14 palavras diferentes para coordenar ataque a predador: gaio-siberiano tem, no total, vocabulário com 25 chamados diferentes. capacidades são parecidas com as de primatas, diz cientista sueco.
neutro;;atlético projeta duas vitórias em casa para não depender de jogo na altitude. furacão também precisará melhorar o saldo de gols ou tropeços dos adversários diretos contra o lanterna se quiser chegar tranquilo à última rodada
neutro;;preço do petróleo fecha em queda em ny: contrato fechou negociado a us$ 53,84. investidores aguardam divulgação dos dados sobre reservas nos eua.
neutro;;hsbc vende participação em empresa por us$ 307 milhões: hms atua no processamento de operações com cartão de crédito. a compradora global payments já detinha o restante da hms.
surpresa;;estudante chinesa encontra camisinha dentro do prato em refeitório. uma estudante chinesa encontrou uma camisinha dentro do arroz na cafeteria de uma universidade em pequim.
neutro;;gaúchos querem transformar chimarrão em patrimônio imaterial: iniciativa teve origem no município de venâncio aires. projeto deve ser encaminhado ao iphan no fim do semestre.
neutro;;policiais civis fazem assembleia nesta sexta-feira em curitiba. profissionais irão analisar resposta apresentada pelo governo em reunião nesta segunda-feira e decidir próximos passos da categoria
