
alegria;;irã liberta viúva condenada ao apedrejamento, diz comitê internacional. a viúva iraniana sakineh mohammadi-ashtiani, condenada à morte por apedrejamento, foi libertada juntamente com o seu filho e o seu advogado, anunciou nesta quinta-feira (9) o comitê internacional contra apedrejamento, sediado na alemanha.
tristeza;;haiti sofre com cólera depois da passagem do furacão sandy. após a passagem do furacão sandy pelo haiti, o país vive as dificuldades da reconstrução, além de problemas causados pela contaminação da bactéria que causa o cólera.
surpresa;;mulher acorda e encontra crocodilo de 3 m e 27 ovos no jardim de casa. especialistas capturaram e transferiram animal para local adequado.
tristeza;;enchentes causam a morte de 4 pessoas em al: vítimas são mãe, filho, idosa de 100 anos e adolescente. defesa civil da capital já registrou mais de 30 ocorrências.
neutro;;sem detalhes do que será discutido, revisão do plano diretor começa na segunda (17). dez oficinas, 19 audiências públicas e canal interativo serão os meios de participação popular; ippuc pretende enviar plano revisado à câmara até o início de dezembro
neutro;;chávez apresenta neto de allende como companheiro da filha: pablo sepúlveda allende é médico e neto de salvador allende. maría, de 29 anos, é a segunda filha do primeiro casamento de chávez.
tristeza;;chefe do pc chinês de xinjiang ameaça executar envolvidos em protestos: forças do governo tomaram as ruas da capital da província, urumqi. confrontos entre uigures, chineses han e a polícia já mataram 156.
raiva;;jovem fingia ser modelo para aliciar crianças na web. guilherme donin é suspeito de chantagear menina de 12 anos na internet.
surpresa;;polícia encontra cocaína escondida em boneco do "shrek". a polícia militar da cidade de euclides da cunha, município 311 km distante de salvador, encontrou uma quantidade de cocaína dentro de um boneco do personagem shrek na terça-feira, 11, após uma série de denúncias anônimas.
surpresa;;aprende-se mais com o sucesso do que com o erro, indica estudo: testes de certo e errado foram aplicados a macacos em laboratório. reação neuronal é mais forte quando teste anterior rendeu recompensa.
surpresa;;avô luta contra tubarão de 2 metros para salvar netos em praia da austrália. a coragem do turista foi destaque em jornais do mundo todo.
neutro;;colômbia se diz disposta a atuar como mediadora na venezuela. presidente colombiano disse que poderia fazer este papel. ele destacou que evitará provocar caracas com seus comentários.
surpresa;;passageiro é flagrado com bagagem repleta de répteis na alemanha. homem viajava do méxico com destino à espanha. bagagem continha cobras, lagartos e diversas tartarugas.
surpresa;;formiga argentina emite substâncias para evitar ser enterrada viva: sinais desaparecem uma hora após a morte do inseto, afirma estudo. com remoção das moléculas, bichos vivos vão para lixão da colônia.
alegria;;carlinhos brown e guilherme arantes cantam para namorados na bahia: apresentação aconteceu na costa do sauípe nesta sexta-feira. brown surpreendeu com músicas românticas na madrugada de sábado.
neutro;;juiz aponta advogado para cuidar das finanças de óctuplos nos eua: mãe, nadya suleman, foi à audiência, mas não se pronunciou. reality show que filmaria sua rotina depende de aprovação da justiça.
medo;;moradores do pi ficam isolados após rompimento de barragem: governo usa helicópteros e embarcações para resgatar famílias. por medida de segurança, fornecimento de energia foi interrompido.
tristeza;;homem é morto com cerca de 40 tiros na zona norte de porto alegre. crime aconteceu por volta das 19h de segunda-feira (19) no bairro sarandi. segundo a polícia, três armas estavam envolvidas no homicídio.
neutro;;calouros escalam monumento coberto de banha em evento nos eua. jovens da academia naval de maryland fizeram torre humana em cerimônia. alunos sobem em obelisco de 6,4 m para marcar fim do ano de calouros.
medo;;mesmo com pandemia, população pode ficar tranquila, diz ministério da saúde: ministra interina informou que transmissão permanece limitada no país. segundo ela, há 52 casos de influenza a confirmados no brasil.
desgosto;;mais de 8 mil empresas japonesas quebraram no primeiro semestre do ano: somente em junho, 1.422 companhias quebraram, segundo pesquisa. japão sofre com recessão.
tristeza;;construção desaba e mata idoso de 68 anos em divinópolis. vítima chegou a ser encaminhada para o pronto-socorro, mas não resistiu. idoso estava na área interna da construção quando houve o desabamento.
surpresa;;testemunha capta explosão no texas em vídeo. explosão surpreende pai e filha que observavam à distância o incêndio em fábrica de fertilizantes próxima a waco.
tristeza;;turquia prende quatro suspeitos de ataque que matou 44 em casamento: noivos e clérigo que realizava a cerimônia estão entre as vítimas. governo descartou terrorismo e disse que trata-se de briga de família.
tristeza;;trabalho forçado gera lucros anuais de us$ 150 bilhões, segundo oit. mulher é principal vítima, explorada sexualmente e no trabalho doméstico. ao todo, 12 milhões de pessoas são forçadas ao trabalho na ásia.
neutro;;rússia lança nave soyuz rumo à estação espacial internacional (iss): canadense, belga e russo vão integrar tripulação do complexo orbital. habitantes fixos da iss, com isso, passarão a ser seis.
tristeza;;crianças morrem congeladas enquanto pais festejam ano novo. filhos do casal tinham dois e três anos e foram encontradas mortas no banheiro da casa.
neutro;;juventus cede empate à fiorentina e complica objetivo de jogar final em casa. após 1 a 1 em turim, time de florença passa a jogar por empate sem gols em casa para avançar às quartas de final da liga europa
tristeza;;motociclista morre após ser atingido por linha com cerol em mg: rapaz de 24 anos passava pela br-116, em governador valadares. segundo polícia, ele não tinha habilitação para dirigir motos.
alegria;;turistas têm aulas de cozinha tradicional árabe em petra: petra kitchen é mais uma grande brincadeira do que uma aula de fato. o trabalho é simples, mas o resultado no prato é excelente.
neutro;;deputados gaúchos coletam nas ruas assinaturas para cpi contra yeda: parlamentares querem apoio de eleitores para investigação. cpi precisa de mais duas assinaturas de deputados para ser criada.
surpresa;;cientistas criam técnica que permite enxergar o que há dentro do cérebro. método utiliza processos químicos e torna cérebro transparente.
medo;;militantes fazem barricada em torno de casa de líder na nigéria: extremistas islâmicos autodenominados talibã deixaram mais de cem mortos em ataques contra civis e policiais no fim de semana.
neutro;;alonso elogia ferrari e mostra confiança para estreia. depois de um ano tumultuado em seu relacionamento com a direção da ferrari, fernando alonso iniciou a temporada 2014, com os treinos livres desta sexta-feira, elogiando a equipe e exibindo confiança para a abertura do campeonato, domingo, no gp da austrália.
neutro;;deputado protocola pec que retoma obrigatoriedade do diploma de jornalismo: paulo pimenta (pt-rs) conseguiu 191 assinaturas na proposta. jornalismo é mais que simples prestação de informação, diz.
alegria;;homem que estuprou menina de 12 anos é preso. acusado de estuprar e engravidar uma garota de 12 anos, o lavrador edimilson rodrigues souza, o "baiano", de 56 anos, foi preso, no sábado (8/12).
medo;;trem descarrila ao partir da central do brasil. um trem da supervia descarrilou por volta das 18h45 desta quinta-feira, 13, logo após partir da estação ferroviária central do brasil, no centro do rio. ninguém se feriu, mas os passageiros precisaram desembarcar e voltar para a estação.
neutro;;após integração, marca itaú deve decorar fachadas das agências: itaú unibanco divulgou resultado do 1º trimestre nesta terça-feira. banco já fechou a financeira taií, para dar espaço à fininvest.
desgosto;;incêndio destrói fábrica de isopor em minas gerais: fogo atingiu galpões onde eram mantidos material de escritório e isopor. peritos vão determinar o que provocou as chamas.
neutro;;por etanol, senador dos eua ameaça adiar aprovação de embaixador no brasil: shannon, indicado por obama, defende fim da tarifa ao álcool do brasil. grassley, senador republicano, é ferrenho defensor da cobrança.
medo;;vulcão intensifica erupção no alasca e põe região em alerta vermelho. vulcão soprou nuvem de fumaça e cinzas de mais de 7 mil metros. alerta vermelho foi o primeiro desde 2009.
medo;;professora diz ter medo de dar aula após ameaça de aluna em ribeirão. docente alega que adolescente quer agredi-la dentro de escola estadual.
alegria;;mercado no kuwait vende melancias no formato de coração por r$ 790. fruta curiosa é importada do japão. melancia é vendida em supermercado da capital.
surpresa;;britânica de 66 anos dá à luz um menino, diz jornal: criança nasceu com aproximadamente 2,5 quilos. ela se tornou a britânica mais velha a se tornar mãe.
neutro;;sete cidades escolhem novo prefeito em eleição fora de época no domingo: cinco cidades de mg, uma do rs e outra do rn terão eleição. nesses locais, justiça anulou resultado do pleito de outubro passado.
tristeza;;piloto morre em queda de ultraleve em brasília. acidente aconteceu perto da br-251, em são sebastião. segundo os bombeiros, apenas a vítima estava na aeronave.
desgosto;;comissão da oab pede liberação de presos por superlotação em delegacia: mais de 40 detentos estão em 3 celas de delegacia em mossoró (rn). para secretário de justiça, demora para julgamentos acarreta problema.
alegria;;conhecido por agredir cadeirante, delegado damasio marino é preso. o delegado damasio marino, conhecido por ter agredido em 2011 um cadeirante em são josé dos campos, no interior de são paulo, foi preso no começo da noite da última sexta-feira.
neutro;;escritor mario vargas llosa é retido em aeroporto na venezuela: peruano está no país para fórum sobre liberdade e propriedade privada. segundo o fórum, ele será escoltado pela polícia até seu hotel.
desgosto;;polícia ainda não identificou suspeito de matar irmão de ex-senador em ro. a vítima foi alvejada com pelo menos dois tiros em ariquemes. equipe de policiais de porto velho deve auxiliar nas investigações.
alegria;;zoológico alemão apresenta tigresas quadrigêmeas ao público: mãe deu à luz bebês sem ajuda de veterinários, afirma parque. felinas já têm pouco mais de um mês de vida.
desgosto;;prejuízo com as cheias em rondônia deve passar de r$ 1 bi. os projetos a serem desenvolvidos no estado dependem de uma engenharia especializada, pois além das estradas e pontes, existe a necessidade de construir protetores das encostas do rio
surpresa;;avatar é o filme mais pirateado de 2010. avatar, o maior sucesso mundial de bilheteria em todos os tempos, foi o filme mais pirateado do ano (foi baixado 16,6 milhões de vezes, segundo dados divulgados por um blog de partilha de arquivos, o torrentfreak.com).
medo;;israel mata um palestino em gaza apesar de cessar-fogo. soldados israelenses mataram um homem palestino a tiros e feriram 19 pessoas ao longo da fronteira da faixa de gaza com israel nesta sexta-feira, segundo uma fonte do setor de saúde de gaza.
medo;;vizinhos da mãe suspeita de matar bebê em natal estão com medo. muitas pessoas têm filhos pequenos, que brincam no pátio. a gente teme que ela volte aqui e seja capaz de fazer mal a qualquer um de nós", desabafou uma moradora que não quis se identificar.
neutro;;tjpe concede registro de dupla maternidade em certidão de gêmeos. nomes das mães e dos avós maternos dos bebês estão no documento. todo processo durou menos de 15 dias, informa advogado.
neutro;;infectologistas desaprovam tabela para diferenciar gripe comum da gripe a: ministério da saúde não endossa orientações que circulam na internet. ‘guias’ de diferenciação sintomática podem causar mais confusão.
medo;;rússia diz que defenderá seus compatriotas na ucrânia. enquanto isso, um navio russo descarregou tropas, caminhões e ao menos um veículo blindado para transporte de pessoal em um baía perto de sebastopol, na crimeia, centro da tensão
neutro;;lucro da lojas renner tem alta de 9,88%, para r$ 47,8 milhões: resultados da empresa no 2º trimestre saíram nesta segunda-feira (27). no acumulado do 1º semestre, receita da rede superou r$ 1 bilhão.
tristeza;;chuvas deixam 10 mortos nas filipinas: ao menos 15 pessoas estão desaparecidas. mau tempo fecha portos e provoca colapso na rede elétrica.
neutro;;mantega admite de novo que brasil entrará em recessão técnica: recessão se caracteriza por dois trimestres seguidos de queda no pib. pib caiu no último trimestre e ministro vê novo recuo 1º trimestre de 2009.
desgosto;;falsa bomba é abandonada no centro de belo horizonte: polícia foi chamada por pessoa que viu artefato em cabine telefônica. interdição de ruas em horário de pico provocou confusão no trânsito.
neutro;;lula nega a jornal ser candidato ao planalto em 2014. o ex-presidente luiz inácio lula da silva disse que "não existe" a possibilidade de ser candidato à presidência da república em 2014, mas não descartou uma volta em 2018, embora ache que "já cumpriu sua missão na presidência".
tristeza;;diabetes mata mais que aids e trânsito no brasil. dados do ministério da saúde divulgados nesta terça-feira (13) indicam que 54 mil brasileiros morreram em 2010 em decorrência do diabetes. isso significa que a doença matou quatro vezes mais do que a aids (12 mil óbitos) e superou o total de vítimas de trânsito (42 mil) no país.
desgosto;;jovem é detido dirigindo moto sem cnh e em alta velocidade em araxá. pm informou que suspeito ignorou ordem de parada no centro da cidade. ele foi preso fazendo manobras perigosas no bairro santo antônio.
neutro;;governo quer estender emissão de extrato do inss a todos os bancos: para que isso ocorra, projeto de lei será enviado ao congresso. pela legislação atual, apenas bb e caixa podem oferecer o serviço.
desgosto;;pedidos de auxílio-desemprego sobem 25 mil nos eua na semana: alta é menor do que a esperada por economistas. total de americanos que recebem benefício tem queda.
tristeza;;casos de dengue ultrapassam 42 mil em mato grosso com 22 vítimas fatais. números são deste ano e foram divulgados pela secretaria de saúde. casos de notificações aumentaram quase 500% em relação a 2011.
tristeza;;delegado suspeita de latrocínio ou execução em caso de pm morto. soldado foi morto a tiros na tarde desta terça-feira, em campo grande. polícia busca suspeitos de cometer crime.
raiva;;vândalos destroem posto de saúde e deixam moradores sem atendimento. caso aconteceu no bairro jardim sabiá, em ponta grossa, nesta quinta. além de quebrar porta de vidro, vândalos furtaram computador.
desgosto;;ateus declaram "guerra ao natal" nos eua. grupos de ateus estão se mobilizando para impedir decoração natalina em locais públicos nos estados unidos, em um movimento batizado por jornais americanos de "guerra ao natal".
alegria;;universidade de ro abre concurso para professores do magistério. são 34 vagas para o corpo docente em todo o estado via concurso. inscrições devem ser feitas pelo site da unir a partir do dia 25 de março.
desgosto;;câmera flagra assalto a radialista e vigilante de prédio em salvador. homem de 63 anos havia sacado dinheiro em banco e pagou funcionário.
tristeza;;perito é morto por policiais militares na bahia: polícia militar informou que policiais foram recebidos a tiros. uma testemunha teria informado que o perito não atirou.
desgosto;;mulher sai de casa por medo de ser morta pelo marido. após 19 anos sendo vítima de violência doméstica, a auxiliar de serviços gerais selma santos brito reis, 36, prestou queixa no complexo policial investigador bandeira, no município de feira de santana (distanet a 108 km de salvador), no final de semana, e resolveu sair de casa com medo de ser morta pelo marido, identificado como hailton de jesus reis.
surpresa;;americano liga para a polícia após esposa jogar cerveja fora e vai preso. carlos bueno estava bêbado e reclamou que bebida tinha sido descartada. homem acabou preso na flórida após repetir ligação pelo mesmo motivo.
neutro;;kassab fala em criatividade para gerar empregos durante crise: prefeito de sp esteve na festa do dia do trabalho da cut. evento acontece na cidade dutra, na zona sul de são paulo.
neutro;;em 12 anos, união banca subsídio de r$ 184 bilhões na dívida de estados: valor supera os orçamentos anuais somados de sp e rj. com queda na taxa selic, estados pressionam por mais concessões.
desgosto;;uruguai estuda isentar maconha de impostos para minar narcotráfico. decreto define preço da maconha comparável ao do mercado negro. uruguaios poderão comprar até 10 gramas por semana em farmácias.
surpresa;;china proíbe jogos de internet que simulem operações da máfia: webgames reúnem jogadores em carreira mafiosa. produções prejudicam moralidade e cultura chinesa, diz governo.
surpresa;;congressista é flagrado comendo cera de ouvido na câmara dos eua. cena aconteceu durante sessão do comitê judiciário da câmara. representante cutucou orelha durante transmissão ao vivo.
surpresa;;marinha francesa captura 11 piratas na costa da somália: eles estavam em duas lanchas, armados com fuzis e um lança-foguetes. piratas confundiram a fragata francesa com um navio mercante.
tristeza;;atirador mata duas pessoas e fere 10 em festa de carnaval no rio. ensaio de um bloco terminou em tragédia na noite de domingo.
tristeza;;pai é suspeito de abusar sexualmente da filha no interior do piauí. menina de 16 anos disse que sofria abusos há oito anos dentro de casa. caso está sendo investigado pela polícia do município de josé de freitas.
neutro;;tse cassa mandato de deputado estadual que trocou de partido no pr. decisão contra alceu maron filho (psdb) foi tomada na noite de quinta (13). o suplente felipe lucas (pps) deve ser o substituto de maron na alep.
surpresa;;filhote de jacaré é capturado por moradores de jaboatão, pe. um exemplar adulto também apareceu no local, mas conseguiu fugir. 
neutro;;câmara aprova texto base do projeto com mudanças na lei eleitoral: propaganda na internet foi regulamentada com restrições. deputados votam agora destaques que podem mudar o texto já aprovado.
medo;;cientistas temem que máquinas superem humanos em inteligência: um dos receios é a exploração criminosa da inteligência artificial. grupo debate imposição de limites às pesquisas.
neutro;;bid dará empréstimo de us$ 3 bilhões ao méxico por gripe e crise: os empréstimos para 2009 são quase triplo do valor oferecido em 2008. objetivo é amenizar os impactos da gripe e da crise econômica.
tristeza;;vinte crianças morrem após comer merenda escolar na índia. uma investigação preliminar indica que a comida poderia estar contaminada com fósforo, utilizado para preservar arroz e trigo
neutro;;segredo de justiça ‘praticamente não existe no brasil’, diz tarso: ele falava sobre divulgação de gravações de conversas da família sarney. ministro critica stf por permitir a advogados acesso a todos os inquéritos.
desgosto;;falta de médicos especialistas faz pacientes procurarem justiça em ms. principais reclamações são na ortopedia, neurocirurgia e oftalmologia. saúde explica o que está sendo feito para atrair mais profissionais.
neutro;;onu reitera que síria se desfaça de suas últimas armas químicas. 7,2% do arsenal de armas químicas da síria ainda estão no país. por acordo, síria deve destruir seu arsenal até 30 de junho.
neutro;;figuras orientais são tendência em convenção de tatuadores no recife: dragões e símbolos da escrita japonesa são os preferidos dos tatuados. tatuador diz que mulheres estão dominando os estúdios de tatuagem.
tristeza;;policiais protestam contra morte de perito em salvador: vítima teria sido baleada por policiais militares. pms negam crime e dizem que foram recebidos a tiros.
raiva;;estupradores de estudante indiana tentaram atropelar a vítima. os estupradores da jovem indiana agredida por vários homens em um ônibus em nova délhi e que morreu no sábado passado tentaram atropelar a vítima depois do ataque, informa a imprensa do país.
desgosto;;movimento é intenso nas agências dos correios do recife após greve. cargas se acumulam nos centros de distribuição. nas agências, clientes tentam resgatar encomendas.
surpresa;;dono pede a usuários que fumem maconha no seu bar em washington. frank schnarr diz que não gosta da erva, mas quer faturar com nova lei. autoridades e advogados não sabem ao certo se procedimento é legal.
alegria;;peixes oleosos podem evitar doença degenerativa nos olhos, diz estudo: consumo de ômega-3 pode frear degeneração macular nos primeiros estágios ou em estágios avançados.
medo;;ladrões fazem arrastões em restaurante e em igreja evangélica. bandidos fizeram arrastão em um restaurante e em uma igreja evangélica neste domingo, em são paulo.
neutro;;a 8 dias da copa, rotatória perto da arena pantanal ainda está em obras. ampliação na frente do círculo militar começou a ser feita no mês passado. primeiro jogo do mundial em cuiabá será no dia 13, entre chile e austrália.
neutro;;oms diz que pode faltar verba contra febre amarela: programa internacional contra a doença pode acabar. governo brasileiro diz que compra estoques e não há risco de falta.
desgosto;;jovens são presos e menor apreendido com drogas em uberaba. polícia encontrou 45 buchas e um tablete de maconha em uma residência. aparelhos celulares, r$ 6.016 em dinheiro e uma moto foram apreendidas.
neutro;;força realiza congresso nacional e elege nova direção: evento, que começa nesta quarta, pretende reunir 4 mil dirigentes sindicais. três ministros devem participar; presença de lula não está confirmada.
neutro;;obras de requalificação mudam trânsito na barra a partir de 2ª feira. passagem ficará interditada na rua marques de leão, informa prefeitura. também será proibido estacionar em algumas regiões do bairro; confira.
desgosto;;professor uruguaio humilha alunos em excursão. através de mensagens de texto, fotografias e encontros, ele dava ordens para que alunos cumprissem seus desejos com pena de expulsão
medo;;casos notificados de dengue aumentam 550% em 2013 no rs. até o dia 16 de fevereiro, foram notificados 208 casos no estado. porto alegre é a cidade com o maior número de casos confirmados.
tristeza;;delegado afirma que morto era inocente: no lugar errado, hora errada. vinícius paiva era estudante e foi baleado em uma ação criminosa. tentativa de assalto ocorreu nesta segunda-feira (19), em praia grande.
surpresa;;satélite da nasa flagra erupção vulcânica em papua-nova guiné: earth observing-1 fez imagem em 28 de junho. vulcão manam é um dos mais ativos da região.
neutro;;juíza manda soltar mulher de boxeador achado morto em pernambuco: segundo tj, delegado considera que suspeita não teve ligação com morte. ela deve deixar prisão na tarde desta quinta-feira.
neutro;;empresas de coleta seletiva não vão receber por lixo misturado, diz gdf. cooperativas reclamam que 80% do lixo coletado têm resíduos orgânicos. slu disse que vai confrontar relatório das cooperativas com o de empresas.
neutro;;líder do psdb analisa denúncia contra o presidente do conselho de ética: paulo duque teria empregado um assessor no colegiado, diz jornal. ele é o mesmo que afirmou que a opinião pública era ‘volúvel’.
desgosto;;chuva faz teresina suspender aulas na rede pública: governador orienta outros prefeitos a adotarem medida. defesa civil do estado diz que 21 cidades decretaram emergência.
surpresa;;transporte de polvo gigante atrai curiosos e gera confusão em londres. caminhão que levava réplica quebrou em cruzamento movimentado. ingleses chegarm até a tirar selfie com estátua curiosa.
neutro;;anp condena discurso de netanyahu e rejeita novas imposições: para autoridade nacional palestina, refugiados não foram considerados. movimento islâmico hamas também condenou o discurso deste domingo.
surpresa;;cachorro vira cãopiloto de bicicleta ao dar passeio com o dono no méxico. animal ficou no posto de copiloto enquanto dono pedalava. cena foi registrada na cidade do méxico pelo fotógrafo ivan pierre aguirre.
surpresa;;pernilongo gordo do rio pinheiros demonstra evolução em tempo real: inseto maior não representa mais perigo à população, diz biólogo. resultado demonstra que larvas ajudam a indicar nível de poluição.
tristeza;;incêndio em fábrica em bangladesh deixa 120 mortos. pelo menos 120 pessoas morreram no sábado à noite após um incêndio que tomou conta de uma fabrica de roupas de oito andares em dhaka, capital de bangladesh, segundo informações do corpo de bombeiros.
raiva;;homens ateiam fogo em usuário de drogas. segundo a polícia, crime aconteceu durante a noite de domingo em ms. suspeitos fugiram e estão sendo procurados.
tristeza;;homem é assassinado no bairro são jorge em uberlândia. crime aconteceu na madrugada desta terça-feira (20). segundo a pm, dois suspeitos efetuaram os disparos e fugiram.
surpresa;;alemães fazem passeio no interior de intestino tamanho família: modelo do órgão humano em dresden é considerado o maior da europa. objetivo da mostra é ensinar a prevenir doenças intestinais, como câncer.
